,tweet
0, elecciones       en  florida   joebiden dice que  donaldtrump solo se preocupa por  l mismo  el dem crata fue anfitri n de encuentros de electores en  pembrokepines  miramar  clic aqu                 elsollatino  yobrilloconelsol  
1, hunterbiden  hunterbidenemails  joebiden  joebidenmuststepdown  
2, biden made    trumpisnotamerica    
3,watching setting dvr  let give bonus rating    joebiden
4, censorship  hunterbiden  biden  bidenemails  bidenemail  corruption  
5, wrong      cory booker brilliant final questioning trump nominee amy coney barrett    amyconeybarrett  corybooker  barrett  booker  trump  kamalaharris  joebiden  scotus  supremecourtconfirmation
6,       nypost  censorship  censored twitter manipulate u election favor  joebiden  trump  ccp  china porn twitter  always fine  katies  sick 
7,   tell politician stick free item                 biden  deomocrat  election  politician  politics  president  republican  trump  vpdebate     
8, biden  
9,proof bidens crooked  twitter suspend sharing    biden  crookedbiden  ukraniancollusion  democrat  hunterbidenemails
10,open  create free u  election pick em pool  add excitement potential chaos  pick think become president  win swing state  popular vote        maga      trump  biden  politics  uselection      
11,fbi allegedly obtained hunter biden computer  data ukraine dealing  report claim  joebiden  hunterbiden  
12, joebiden point man  
13,locking account cause yall dont want truth come  biden crazy af  
14, trump      blm  obama  votered  bidenharris      blacklivesmatter  mikepence  debate      kamalaharris  kamalaharrisvp  biden  riot  hunterbidden  aoc  trump  ilhanomar  gavinnewsom  tedwheeler  gretchenwhitmer  gt  gt  begining going get worse   
15, icecube sellout long black people going vote democrat nothing u look  democrat really mean mean satan  joebiden admitted  pedophilia  trump    tosaveamerica  
16,breaking   twitter safety account provides info taken action  nypost story   article link discus  joebiden son  hunterbiden   censorship  facebook  maga  
17,comment   democrat understand ruthless china      china  hunterbiden  joebiden  bidenharris  bidenharris      trumppence      trump  realdonaldtrump  wto  coronavirus  trade  
18,   joebiden admitting
19,going share thing like biden    bidencares  biden  chickentrump  kamalaharris  
20, hunterbiden  hunterbidenemails  joebiden  joebidenmuststepdown  
21,effort find truth allegation allowing people share link article hunter biden  popped  nypost  hunterbiden  biden  election      
22,twitter everything help democrat win election  making sure nobody see negative story biden  negative story trump   twittercensorship  biden  ukraine  hunterbiden  
23, joebiden call lier insult overweight  biden show low iq daily  maybe joe hold town hall kindergarten  amongst equal one say anything take afternoon nap  
24,vote wisely  wisely mean joe  else see v     joebiden  
25, bidencrimefamily  joebiden  hunterbiden  hunterbidenemails  
26,vote  joebiden  
27, trump tearing  biden  trumprally  hunterbidenemails
28, trump  obama  clinton  biden  manwomanpersoncameratv  rockpaperscissors  handsfacespace  votejoebiden  uselection  uselection      penny v  harris  drugstest  trumpdrugs  bidendrugs  injectdisinfectant  powerfullight skin way                   
29,come please right thing  move  biden town hall  bet requirement orange monkey nbc town hall opposite biden  please move 
30,action facebook twitter  newyorkpost expose  biden son convince corporate medium manufactured news mic thought control bullshit  nothing 
31, omg   probably whispering  biden ear   f ck    china counting u      notpp  stoptpp  nocptpp  stopcptpp      
32,god forbid biden get anything  control  nothing  watch  biden  get control every slightest question  person like  commander chief united state america  
33,usually bother  huge effort response  biden story 
34, realdonaldtrump address  joebiden  hunterbiden corruption  proof discovered laptop   obamabidengate  nypost  msnbc  cbs  nbc  abc  foxnews  kamalaharris  
35, unflatteringdogphotochallenge  hunterbiden  cnn  biden  chickentrump  americafirst  bachelorette    dayfiance  bigbrother  coronavirus  bidenharris      joebiden    
36,simple question  voting       election  donaldtrump  joebiden  uspoli  mapoli
37,since censoring free speech  regard  joebiden email scandal  opened account  done without motivation   parler  censorship  twitter  conservative
38,oh barf  video  biden bragging withholding money  ukraine unless complied  fact crap 
39, biden  
40,blocking people account hunter biden introduced dad ukraine dude          joebiden explaining  
41,awoken slumber yet getting point even may file negative story  biden   
42,since twitter censoring news  screen shot     censorship  biden  bidenharris      nypost  
43,amazing day    time well spent    vote  maskupuas  foxnews   cnn  joebiden  trumpisalaughingstock
44,tar  amp  feather question quid pro quo ukrainian  medium democrat suppressing story hiding government corruption  joebiden   support corruption  let tar feather  biden
45, twitter lie  joebiden  
46,hunter biden email demonstrate crooked biden family   biden
47, twitter  hunterbiden  bigtechcensorship  bigtech  bigtechcoup  joebiden  biden  
48,ignoring biden family shady dealing china   biden ny post expose biden crime  senate homeland security committee investigating hunter biden email    realdonaldtrump
49,vote wisely  wisely mean joe  else    joebiden  
50,hunter  biden introduced father  vice president joe biden  top executive ukrainian energy firm le year elder biden pressured government official ukraine firing prosecutor investigating company  according email
51,guess  beaubiden crooked father  joebiden   democrat party circling drain  america love back larry sinclair
52,hunter  biden introduced ukrainian businessman vp dad real  twitter facebook literally block every  posting story link  amp  mainstream  newyorkpost  hate trump  censorship never progress   right   left 
53,night met cast  tww wearing shirt    vote  voteblue  joebiden  lovetrumpshate  
54,load crap  twitter attempting justify censorship  ukrainegate article especially acted step suppress information  stepped   putting thumb scale  biden  amp  must pay price   
55,thinking watching  steamingpileoftrump town hall thursday  please reconsider   joebiden previously announced town hall   time thursday   boycott  amp   trumptownhall  watch  abc instead   boycottmsnbc  boycottnbc  resist  metoo  
56,video recount  trump stupid history hurricane   joebiden  biden      bluewave      trumpmadeinchina  voteoutracism  trumphoaxedamerica  votingformyamerica  americasgreatestmistake  trumphateswomen  yeswecan  trumpisacompletefailure  
57, biden  bidenharris      bidenharris  
58, biden supporter like  stormarea   fokes  good american hopefully found  trumppence      votetrump    tosaveamerica   
59, trumpisalaughingstock iowa cult rally compared  joebiden putin  xi  kim jong un  sentence called  shot    communist leader  sharp   trumpisanationaldisgrace
60, joebiden liar  blocking people state fact dishonest  
61, joebiden elected president one u 
62,biden  bush bombshell   nasty lying guilty hunter biden   wow  court document expose slime  biden   
63,serious interference censorship ongoing democratic election twitter  proof  hacked material    news  politics  censorship  election      election  biden  trump  
64, biden loser x    
65,f   washingtonpost confirms   actual video  joebiden saying literally   twitteristhednc  
66,shadow  hillary firing suicide machine   biden  hunterbiden  hunterbidenemails
67, biden people bat   
68, dear hunter  thank inviting dc giving opportunity meet father spent  sic  time together  realty  sic  honor pleasure    vadym pozharskyi  adviser board burisma  joebiden  corruption  bidenharris  hunterbiden  
69,twitter corrupt     see  corruption  biden  hunterbiden  hunterbidenemails  hunterscrackpipe  obamabidengate  fakenews
70, ad like u  ireland uptick case advocating     million ppl die using idiotic  herd immunity    biden
71,reason twitter locked new york post account post reporting explosive new revelation prove  joebiden lied coverup corrupt illegal activity vice president   
72,state race south carolina            polling average  trump              yesterday  biden              yesterday  win probabiity  trump               yesterday  biden        source  fivethirtyeight  electiontwitter  election      biden  trump
73,powerful actor trying twist arm american voting  biden seem understand human behavior  forcefully blindfolding leading voter away medium story biden make look really  really bad   
74,uh oh joe    thing really seem unwinding fast   bidenharristosaveamerica  bidenharrislandslide      bidenharris  biden  joehidin  heelsupharris   harrisbiden      trumpcovid    trump      trump    landslide    kag      
75,laptop computer abandoned delaware repair shop contains  email  hunterbiden  amp  senior  burisma  adviser indicating hunter arranged meeting vp  joebiden  amp  adviser washington  dc       joe biden call lid  amp  hide  
76,    year wanted destroy  socialsecurity      st time generation  gop president willing go way   abolish program help  senior  one reason voted    joebiden   florida  virginia  northcarolina  pa  ohio
77, hunterbiden  amp   joebiden busted  email released   wakeupamerica  kag  trump    
78,hoyl      icecube  joebiden
79,five cent say gal named karen voting trump  lol   biden  
80, twittet  facebook run  biden  presidentialelection      uselection      know  sheep   
81, biden lied  
82,leading  trump baiden  follow link know     usa  uspresidentialelections      uselection  uselection      trumpcovid    trump  joebiden  uselectiondialogues  election      election      electionday  trump    
83,biden  p resident trump fo u r year  donaldtrump  joebiden  election      
84,much r automated digital forensic progs sort analysis vy quickly  e g   encase   amp  u r looking   high lvl characterization drive  amp  file content  overt data   keyword  image  email  amp  doc parsing help w  triaging high value info   biden  
85, living communist china    even tweet  nypost bombshell  hunter  biden story   absolute disgrace  direct assault freedom speech   hunterbidenemails  twittercensorship  maga      trump      
86,   biden  hunterbiden  hunterbidenemails  bidenharris
87,twitter  please fact check picture hunter biden passed crack pipe mouth     biden  hunterbiden  
88,skip  hack covering  joebiden plain simple   hunterbiden  burismaboys
89,vice president  biden    year young  willing bet long list thing rather focus enjoy life  cleaning   deadly mess left spineless republican  donthecon motive  buildbackbetter  votefordemocracy  vote
90,still act  joebiden    point behind  vote 
91,twitter censoring information biden crime family  hunterbiden  hunterbidenemails  joebiden  bidens  joebidenissick  bidenslaveowners  bidenharris      bigmikeobama
92,twazis say blocked ny post  hunterbiden story cuz block story stolen info  let test theory  amp   leftist agenda protecting  biden story  nypost stolen secret audio tape  trump   liberalprivilege  maga  
93,thinking watching  steamingpileoftrump town hall thursday  please reconsider   joebiden previously announced town hall   time thursday   boycott  trumptownhall  amp   cnbc watch  abc instead   boycottmsnbc  boycottnbc  resist  metoo  
94,helping  biden lmao  contrary 
95, joebiden hiding   
96,still retweet report  hunterbiden allegedly selling access vp daddy  biden     
97,newly released info prof  bidens corrupt core  time hoe step  stepdownjoe  joebiden  election    
98,vote wisely  wisely mean joe  else    joebiden  
99, hunterbiden  cocaine  joebiden  kamalaharris far reaching implication vp president  
