,tweet
0, elecciones       en en  florida   joebiden dice dice que  donaldtrump solo solo se se preocupa por  l l mismo  el el dem crata fue anfitri n n de de encuentros de de electores en en  pembrokepines y  miramar  clic aqu                 elsollatino  yobrilloconelsol  
1, hunterbiden  hunterbidenemails  joebiden  joebidenmuststepdown  
2,this is how  biden made made his    trumpisnotamerica    
3,watching watching and setting setting dvr  let let s give give him bonus bonus rating    joebiden
4, censorship censorship  hunterbiden  biden  bidenemails  bidenemail  corruption corruption  
5, is this wrong wrong      cory booker booker s brilliant brilliant final final questioning of trump trump nominee nominee amy amy coney barrett    amyconeybarrett  corybooker  barrett  booker booker  trump trump  kamalaharris  joebiden  scotus  supremecourtconfirmation
6,in        nypost is being  censorship censorship  censored by twitter twitter to manipulate manipulate a u u election election in favor favor of  joebiden and against  trump trump  but ccp from  china china or porn on twitter twitter  that s always always been fine fine for  katies  is sick sick 
7,   tell tell politician to stick stick it with this free free item item                 biden  deomocrat  election election  politician politician  politics politics  president president  republican republican  trump trump  vpdebate     
8, biden  
9,proof proof bidens are crooked crooked  twitter twitter will suspend suspend me for sharing    biden  crookedbiden  ukraniancollusion  democrat  hunterbidenemails
10,now open open  create create a free free u u s  election election pick pick em em pool pool  add add some excitement excitement to the potential potential chaos chaos  pick pick who you think think will become become president president  who will win win the swing swing state  the popular popular vote vote  and more       maga      trump trump  biden  politics politics  uselection      
11,fbi allegedly allegedly obtained hunter biden computer computer  data data on ukraine dealing  report report claim  joebiden  hunterbiden  
12, joebiden wa the point point man man  
13,y all just locking locking up account cause cause yall dont dont want want the truth truth to come come out about  biden that s crazy crazy af  
14, trump trump      blm  obama  votered  bidenharris      blacklivesmatter  mikepence  debate      kamalaharris  kamalaharrisvp  biden  riot  hunterbidden  aoc  trump trump  ilhanomar  gavinnewsom  tedwheeler  gretchenwhitmer  gt  gt  this is only the begining it going going to get get worse worse   
15, icecube t a sellout sellout how long long are black black people people going going to vote vote for democrat and they do nothing nothing for u u look look up what  democrat really really mean mean it mean satan satan  joebiden admitted admitted to  pedophilia pedophilia  trump trump    tosaveamerica  
16,breaking breaking   twitter twitter safety safety account account provides info on why they have taken taken action action against  nypost story story   article article link link that discus  joebiden and his son son  hunterbiden   censorship censorship  facebook  maga  
17,comment on this   do democrat understand understand how ruthless ruthless china china is      china china  hunterbiden  joebiden  bidenharris  bidenharris      trumppence      trump trump  realdonaldtrump  wto  coronavirus  trade trade  
18,  here is  joebiden admitting to it
19,i m going going to share share thing i like like about biden more  you should too   bidencares  biden  chickentrump  kamalaharris  
20, hunterbiden  hunterbidenemails  joebiden  joebidenmuststepdown  
21,in an effort effort to find find the truth truth about allegation that t allowing people people to share share the link link to a article article about hunter biden  this is what popped up  nypost  hunterbiden  biden  election election      
22,twitter twitter is doing everything everything they can to help help democrat win win the election election  making making sure sure nobody nobody see a negative negative story story about biden  only negative negative story on trump trump   twittercensorship  biden  ukraine  hunterbiden  
23, joebiden call him a lier lier and then insult him for being overweight overweight  biden show his low low iq daily daily  maybe maybe joe joe should hold hold town town hall in kindergarten kindergarten  he be amongst amongst equal and no one one will say say anything anything when he take his afternoon afternoon nap nap  
24,vote vote wisely wisely  and by wisely wisely i mean mean for joe joe  or else else we will have to see see on t v v  for    joebiden  
25, bidencrimefamily  joebiden  hunterbiden  hunterbidenemails  
26,vote vote for  joebiden  
27, trump trump is tearing tearing up  biden at the  trumprally over the  hunterbidenemails
28, trump trump  obama  clinton  biden  manwomanpersoncameratv  rockpaperscissors  handsfacespace  votejoebiden  uselection  uselection      penny penny v  harris  drugstest  trumpdrugs  bidendrugs  injectdisinfectant  powerfullight through the skin skin or some other way way                   
29,come come on please please do the right right thing thing  move move the  biden town town hall hall  i bet bet a requirement requirement for orange orange monkey monkey to do the nbc town town hall hall wa to have it opposite opposite biden  please please move move yours 
30,if the action of facebook and twitter twitter over the  newyorkpost expose expose on  biden and his son son t convince convince you that the corporate corporate medium medium is manufactured news news mic thought thought control control bullshit  nothing nothing will 
31, omg   he probably probably be whispering whispering in  biden s ear ear   don t f f ck this up    china china is counting counting on u u      notpp  stoptpp  nocptpp  stopcptpp      
32,god god forbid forbid that biden should get get anything anything  no control control  nothing nothing  if you watch watch  biden  he get out of control control on every every slightest question  how can a person person like like him  be a commander commander in chief chief of the united united state of america  how 
33,you don t usually usually bother bother  why the huge huge effort effort in response response to the  biden story story 
34, realdonaldtrump address  joebiden and  hunterbiden corruption corruption  more proof proof of which discovered discovered on a laptop   obamabidengate  nypost  msnbc  cbs  nbc  abc  foxnews  kamalaharris  
35, unflatteringdogphotochallenge  hunterbiden  cnn  biden  chickentrump  americafirst  bachelorette    dayfiance  bigbrother  coronavirus  bidenharris      joebiden    
36,a simple simple question question  who are you voting voting for       election election  donaldtrump  joebiden  uspoli  mapoli
37,since since you are censoring free free speech speech  in regard to the  joebiden email scandal scandal  i opened up a account account  i t have done done it without without your motivation motivation   parler  censorship censorship  twitter twitter  conservative conservative
38,oh oh barf  video video of  biden bragging bragging about withholding the money money to  ukraine unless unless they complied  fact fact not your crap crap 
39, biden  
40,blocking blocking people people from their account account because hunter biden introduced his dad dad to the ukraine dude dude          joebiden some explaining explaining to do  
41,this awoken you from your slumber yet yet getting getting to the point point where even even you may may have to file file a negative negative story story about  biden   
42,since since twitter twitter is censoring news news  here s the screen screen shot shot     censorship censorship  biden  bidenharris      nypost  
43,amazing amazing what you can do these day day    time time well well spent spent  not   vote vote  maskupuas  foxnews   cnn  joebiden  trumpisalaughingstock
44,while you have the tar tar  amp  feather out why don t you question question about the quid quid pro pro quo quo with the ukrainian the  medium medium and democrat are suppressing the story story and hiding the government government corruption corruption by  joebiden   do you support support corruption corruption  if not let let s tar tar and feather feather  biden
45, twitter twitter lie here is  joebiden  
46,hunter biden email demonstrate demonstrate the crooked crooked biden family family   biden
47, twitter twitter  hunterbiden  bigtechcensorship  bigtech  bigtechcoup  joebiden  biden  
48,all ignoring biden family family shady shady dealing with china china   biden ny post post expose biden crime  senate senate homeland homeland security security committee committee investigating investigating hunter biden email    realdonaldtrump
49,vote vote wisely wisely  and by wisely wisely i mean mean for joe joe  or else else    joebiden  
50,hunter  biden introduced his father father  then vice vice president president joe joe biden  to a top top executive executive at a ukrainian energy energy firm firm le le than a year year before the elder elder biden pressured government government official in ukraine into firing firing a prosecutor prosecutor who wa investigating investigating the company company  according according to email
51,i guess guess  beaubiden wa just a crooked crooked a his father father  joebiden   democrat democrat party party is circling circling the drain drain  america love and back you larry larry sinclair
52,hunter  biden introduced ukrainian businessman businessman to vp dad dad that is real real  twitter twitter and facebook literally literally block block every every  from posting posting this story story and link link to it  amp  this is mainstream  newyorkpost  i hate hate trump trump  but censorship censorship is never never a progress progress   be it from right right   be it from left left 
53,this is from the same night night i met met the cast cast of  tww and i wa wearing wearing the same shirt shirt a    vote vote  voteblue  joebiden  lovetrumpshate  
54,what a load load of crap crap from  twitter twitter attempting to justify justify their censorship censorship of  ukrainegate article article especially especially when they acted in step step with to suppress suppress this information information  both stepped stepped in   by putting their thumb on the scale scale for  biden  amp  must must pay pay the price price   
55,thinking thinking of watching watching the  steamingpileoftrump town town hall hall thursday  please please reconsider reconsider   joebiden a previously previously announced town town hall hall on   the same time time on thursday   boycott boycott  amp  the  trumptownhall  watch watch  abc instead instead   boycottmsnbc  boycottnbc  resist resist  metoo  
56,video video from the recount recount  trump trump s stupid stupid history history with hurricane   joebiden  biden      bluewave      trumpmadeinchina  voteoutracism  trumphoaxedamerica  votingformyamerica  americasgreatestmistake  trumphateswomen  yeswecan  trumpisacompletefailure  
57, biden  bidenharris      bidenharris  
58, biden supporter are the like like the  stormarea   fokes  for the good good of all american hopefully hopefully they can be found found and they  trumppence      votetrump    tosaveamerica   
59, trumpisalaughingstock at his iowa cult cult rally rally compared  joebiden to putin  xi xi  and kim kim jong un un  in the same sentence sentence he called  shot shot  and all   communist communist leader  sharp sharp   trumpisanationaldisgrace
60,is  joebiden a liar liar  blocking blocking people people who state state fact is dishonest dishonest  
61, joebiden you will not be elected president president because you are not one one of u u 
62,biden  bush bush bombshell   nasty nasty lying lying guilty guilty hunter biden   wow wow  court court document expose expose the slime slime the  biden s are   
63,this is serious serious interference interference and censorship censorship in an ongoing ongoing democratic democratic election election twitter twitter  what proof do you have that this is  hacked hacked material    news news  politics politics  censorship censorship  election election      election election  biden  trump trump  
64, biden loser x x    
65,and what the f f is this   washingtonpost confirms   there is an actual actual video video of  joebiden saying saying he literally literally did this   twitteristhednc  
66,some where in the shadow  hillary is firing firing up her suicide suicide machine machine   biden  hunterbiden  hunterbidenemails
67,these are  biden people people with bat bat   
68, dear dear hunter  thank thank you for inviting inviting me to dc and giving giving an opportunity opportunity to meet meet your father father and spent spent  sic sic  some time time together together  it s realty realty  sic sic  an honor honor and pleasure pleasure    vadym pozharskyi  an adviser adviser to the board board of burisma  joebiden  corruption corruption  bidenharris  hunterbiden  
69,twitter twitter is so corrupt corrupt     we see see you  corruption corruption  biden  hunterbiden  hunterbidenemails  hunterscrackpipe  obamabidengate  fakenews
70, why t we ad like like this in the u u  ireland an uptick in case and they t advocating     million million ppl die die using idiotic idiotic  herd herd immunity immunity    biden
71,the reason reason why twitter twitter locked locked the new new york york post post account account is because the post post is reporting on explosive explosive new new revelation that prove prove  joebiden lied lied to coverup his corrupt corrupt and illegal illegal activity activity a vice vice president president   
72,state state of the race race in south south carolina a of            polling polling average average  trump trump              from yesterday yesterday  biden              from yesterday yesterday  win win probabiity  trump trump               from yesterday yesterday  biden        source source  fivethirtyeight  electiontwitter  election election      biden  trump trump
73,powerful powerful actor are trying trying to twist twist the arm arm of american into voting voting for  biden but don t seem seem to understand understand human human behavior behavior  forcefully forcefully blindfolding and leading leading voter away away from a medium medium story story about biden only make him look look really really  really really bad bad   
74,uh oh oh joe joe    thing really really seem seem to be unwinding unwinding fast fast now   bidenharristosaveamerica  bidenharrislandslide      bidenharris  biden  joehidin  heelsupharris   harrisbiden      trumpcovid    trump trump      trump trump    landslide landslide    kag      
75,laptop computer computer abandoned abandoned at delaware repair repair shop shop contains  email between  hunterbiden  amp  senior senior  burisma  adviser adviser indicating hunter arranged a meeting meeting between then vp  joebiden  amp  the adviser adviser in washington  dc in       joe joe biden call a lid lid  amp  hide  
76,for     year the wanted to destroy destroy  socialsecurity     the  st st time time in my generation generation  the gop a president president willing willing to go go all the way way   abolish abolish the program program that help  senior  this is one one of the reason i voted    joebiden   florida  virginia  northcarolina  pa pa  ohio
77, hunterbiden  amp   joebiden are so busted busted  email released   wakeupamerica  kag  trump trump    
78,hoyl      icecube  joebiden
79,five five cent say this gal gal is named karen and voting voting for trump trump  lol   biden  
80, twittet and  facebook run run for  biden at  presidentialelection      uselection      just to know know  are you a sheep sheep   
81, biden lied lied  
82,who is leading leading  trump trump or baiden  follow follow the link link to know know     usa  uspresidentialelections      uselection  uselection      trumpcovid    trump trump  joebiden  uselectiondialogues  election election      election      electionday  trump trump    
83,biden for  p p resident resident trump trump fo u u r r more year  donaldtrump  joebiden  election election      
84,not so much much a there r r automated digital digital forensic forensic progs that do this sort sort of analysis analysis vy quickly quickly  e e g g   encase encase   amp  if u u r r just looking looking   a high high lvl characterization characterization of drive drive  amp  file file content content  overt overt data data   keyword  image  email  amp  doc doc parsing help w w  triaging high high value value info   biden  
85, we re now living living in communist communist china china    can t even even tweet tweet about the  nypost s bombshell bombshell  hunter  biden story story   you re an absolute absolute disgrace disgrace  this is a direct direct assault assault on our freedom freedom of speech speech   hunterbidenemails  twittercensorship  maga      trump trump      
86,   biden  hunterbiden  hunterbidenemails  bidenharris
87,twitter twitter  please please fact fact check check this picture picture of hunter biden passed out with a crack crack pipe pipe in his mouth mouth     biden  hunterbiden  
88,skip skip it  you hack are covering covering for  joebiden plain plain and simple simple   hunterbiden  burismaboys
89,vice vice president president  biden is    year young young  i am willing willing to bet bet that he a long long list list of thing he d rather rather focus focus on and enjoy enjoy life life  than cleaning cleaning up   the deadly deadly mess mess left left by spineless spineless republican and  donthecon his only motive motive is to  buildbackbetter  votefordemocracy  vote vote
90,i will still still act act a if  joebiden is    point behind behind  and vote vote for him 
91,twitter twitter is censoring all information information about the biden crime crime family family  hunterbiden  hunterbidenemails  joebiden  bidens  joebidenissick  bidenslaveowners  bidenharris      bigmikeobama
92,twazis say they blocked blocked ny post post s  hunterbiden story story cuz they block block story with stolen stolen info  let let s test test their theory theory  amp   leftist leftist agenda agenda in protecting protecting  biden with the story story by the  nypost on stolen stolen secret secret audio audio tape of  trump trump   liberalprivilege  maga  
93,thinking thinking of watching watching the  steamingpileoftrump town town hall hall thursday  please please reconsider reconsider   joebiden a previously previously announced town town hall hall on   the same time time thursday   boycott boycott the  trumptownhall on  amp   cnbc watch watch  abc instead instead   boycottmsnbc  boycottnbc  resist resist  metoo  
94,you re not helping helping  biden lmao  on the contrary contrary 
95,where s  joebiden hiding out   
96,i still still can t retweet this report report on  hunterbiden allegedly allegedly selling selling access access to his then vp daddy daddy  biden  not   a of  
97,newly newly released info prof it  bidens are corrupt corrupt to the core core  time time for hoe hoe to step step down  stepdownjoe  joebiden  election election    
98,vote vote wisely wisely  and by wisely wisely i mean mean for joe joe  or else else    joebiden  
99, hunterbiden  cocaine cocaine  joebiden  kamalaharris far far reaching reaching implication for vp president president  
